{
  "schema_version": "v1",
  "id": "plan-meal-planner-001",
  "task_id": "task-meal-planner-001",
  "steps": [
    {
      "id": "step-inspect-brownfield-context",
      "description": "Inspect the meal-planner repo profile, identify safe working roots, and confirm the shopping-list route as the bounded change surface.",
      "depends_on": [],
      "status": "done"
    },
    {
      "id": "step-update-empty-state",
      "description": "Update frontend/src/routes/shopping-list/index.tsx so the empty state explains the dependency on meal plans and adds a route-level call to action.",
      "depends_on": [
        "step-inspect-brownfield-context"
      ],
      "status": "done"
    },
    {
      "id": "step-run-repo-validation",
      "description": "Attach repo-native validation evidence using the canonical commands defined by the meal-planner repo profile.",
      "depends_on": [
        "step-update-empty-state"
      ],
      "status": "done"
    }
  ],
  "success_criteria": [
    "The plan references real files and commands in meal-planner.",
    "The execution stays inside allowed working roots.",
    "Evaluation evidence maps repo-native validation into canonical platform records."
  ]
}
